{
  "schema_version": "1.0",
  "execution_id": "exec_test_replay_0001",
  "status": "succeeded",
  "output": { "message": "synthetic replay", "replayed": true },
  "correlation_id": "corr_test_replay_0001",
  "trace_id": "trace_test_replay_0001",
  "timing": { "started_at": "2030-01-01T01:00:00Z", "completed_at": "2030-01-01T01:00:01Z", "duration_ms": 1000 },
  "audit_reference": "audit/audit_test_replay_0001"
}
